{
  "assetId": "advisor-classifier",
  "description": "ParentOS advisor intent-parse content asset. Spec owns task typing, strategy selection and reviewed-domain gates; this asset owns the domain definitions, natural-expression examples, task examples and record-group definitions given to the bounded intent-parse call.",
  "schemaVersion": 2,
  "contentVersion": "2026-09-30.2",
  "schema": "schema.json",
  "authorityClass": "curated_knowledge_asset",
  "ownerContract": "rule.parentos.advs.r002",
  "generatedModule": "advisor-classifier.gen.ts",
  "review": {
    "status": "needs_review",
    "owner": "parentos",
    "reviewer": null,
    "lastReviewedAt": null
  },
  "primarySection": "domains",
  "sections": [
    {
      "sectionId": "domains",
      "kind": "singleton",
      "files": "domains.json",
      "ordering": "manifest",
      "orphanPolicy": "fail_close",
      "idField": "domain"
    },
    {
      "sectionId": "tasks",
      "kind": "singleton",
      "files": "tasks.json",
      "ordering": "manifest",
      "orphanPolicy": "fail_close",
      "idField": "task"
    },
    {
      "sectionId": "recordGroups",
      "kind": "singleton",
      "files": "record-groups.json",
      "ordering": "manifest",
      "orphanPolicy": "fail_close",
      "idField": "groupId"
    }
  ]
}
